<?xml version="1.0" encoding="UTF-8"?>
<xs:schema xmlns:xs="http://www.w3.org/2001/XMLSchema">
    <xs:element name="editoriales">
        
    </xs:element>
    <xs:element name="editorial" >
    <xs:complexType>
        <xs:sequence>
            <xs:element name="nombre" type="xs:string"></xs:element>
            <xs:element name="direccion" type="xs:string"></xs:element>
            <xs:element name="email" type="xs:string"></xs:element>
            <xs:element name="pagina_web" type="xs:string"></xs:element>
            <xs:element name="telefono">
                <xs:simpleType>
                    <xs:restriction base="xs:integer">
                        <xs:pattern value="[0-9]*"></xs:pattern>
                    </xs:restriction>
                </xs:simpleType>
            </xs:element>
            <xs:element name="fax">
                <xs:simpleType>
                    <xs:restriction base="xs:integer">
                        <xs:pattern value="[0-9]*"></xs:pattern>
                    </xs:restriction>
                </xs:simpleType>
            </xs:element>
            <xs:element name="libro" minOccurs="1" maxOccurs="unbounded">
                <xs:complexType>
                    <xs:sequence>
                        <xs:element name="titulo" type="xs:string"></xs:element>
                        <xs:element name="autor" type="xs:string"></xs:element>
                        <xs:element name="fecha" type="xs:string"></xs:element>
                        <xs:element name="isbn" type="xs:integer"></xs:element>
                    </xs:sequence>
                </xs:complexType>
            </xs:element>
        </xs:sequence>
    </xs:complexType>

    </xs:element>
</xs:schema>
